{
  "id": "01ARZ3NDEKTSV4RRFFQ69G5FAV",
  "rev": 1,
  "created_at": "2026-10-16T12:00:00Z",
  "updated_at": "2026-10-16T12:00:00Z",
  "name": "synthetic project",
  "sources": [
    {
      "locator": "spec.md",
      "digest": "aaaaaaaaaaaaaaaaaaaaaaaaaaaaaaaaaaaaaaaaaaaaaaaaaaaaaaaaaaaaaaaa",
      "version": "v1",
      "registered_at": "2026-10-16T12:00:00Z"
    }
  ],
  "delegations": [
    "saga-delegation-1"
  ],
  "interface_decision_owner": "01ARZ3NDEKTSV4RRFFQ69G5FAW"
}
